{
  "$schema": "http://json-schema.org/draft-07/schema#",
  "title": "GroundTruthFixture",
  "description": "Schema for test_skus_ground_truth.json — the canonical fixture for OBS regression and evaluation testing. Each entry represents a known product with verified expected values for scraper validation.",
  "type": "array",
  "items": {
    "type": "object",
    "required": [
      "upc",
      "brand",
      "name",
      "expected_source_url",
      "expected_source_domain",
      "expected_source_tier",
      "expected_fields"
    ],
    "properties": {
      "upc": {
        "type": "string",
        "description": "Product UPC/UPC identifier. Must be a non-empty string.",
        "minLength": 1
      },
      "brand": {
        "type": "string",
        "description": "Verified brand name (canonical form, e.g. 'Scotts' not 'ScottsMiracle-Gro').",
        "minLength": 1
      },
      "name": {
        "type": "string",
        "description": "Full product name as it appears on the official source page.",
        "minLength": 1
      },
      "description": {
        "type": "string",
        "description": "Product description from the official source. Optional but recommended."
      },
      "size_metrics": {
        "type": "string",
        "description": "Size/quantity string (e.g. '1.5 cu ft', '8 lb', '25 Quart'). Parsed by ground_truth_loader._parse_size_metrics()."
      },
      "images": {
        "type": "array",
        "description": "List of product image URLs from the official source.",
        "items": {
          "type": "string",
          "format": "uri"
        }
      },
      "categories": {
        "type": "array",
        "description": "Product category tags.",
        "items": {
          "type": "string"
        }
      },
      "source": {
        "type": "string",
        "description": "Comma-separated list of known sources (legacy field, superseded by expected_source_*)."
      },
      "expected_source_url": {
        "type": "string",
        "description": "The verified official manufacturer URL for this product. Must be a valid http/https URL.",
        "format": "uri",
        "minLength": 1
      },
      "expected_source_domain": {
        "type": "string",
        "description": "The expected official domain (e.g. 'scotts.com', 'mannapro.com'). Used for domain-matching assertions.",
        "minLength": 1
      },
      "expected_source_tier": {
        "type": "string",
        "description": "Source tier classification for the expected URL.",
        "enum": [
          "official",
          "official_variant",
          "major_retailer",
          "secondary_retailer",
          "marketplace",
          "retailer",
          "unknown"
        ]
      },
      "expected_fields": {
        "type": "array",
        "description": "List of field names that the scraper is expected to successfully extract for this product. Used to validate extraction coverage.",
        "items": {
          "type": "string",
          "enum": [
            "name",
            "brand",
            "description",
            "price",
            "images",
            "size_metrics",
            "upc",
            "categories"
          ]
        },
        "minItems": 1
      },
      "difficulty": {
        "type": "string",
        "description": "Extraction difficulty rating for this product. Used to stratify test results.",
        "enum": ["easy", "medium", "hard"],
        "default": "easy"
      },
      "price": {
        "type": ["string", "number", "null"],
        "description": "Known product price (optional, may be null if unavailable)."
      }
    },
    "additionalProperties": false
  },
  "maxItems": 50
}